,data,flag
881,If you could be the current world champion in any one sport which sport would it be?,8
882,How long will it take for me to become an advanced tennis player if I started a year ago and go to practice everyday of the week for 3-5 hours a day. I also have an L5 tournament coming up?,8
883,"In terms of speed, strength, conditioning, and coordination, which professional sport has the most fit athletes?",8
884,Do you think that there are sports that are more appropriate for men?,8
885,"I am creating a ball (which can be thrown or kicked) and goal sport for all heights of people to play, how can I achieve this?",8
886,What are the active safety features of the Mercedes GLA 200 Sport?,8
887,How can I watch a live ATP tennis match for free?,8
888,How has the material used for making tennis rackets been changed from ancient times to modern times?,8
889,What determines whether bowling is a sport or a game?,8
890,Will the MLB ever regain it's top spot as the most popular sport in the US? Do you think it's popularity will go up in the next 20 years?,8
891,Which are some pro sports where height doesn't matter?,8
892,What’s the craziest sports moment of your life?,8
893,What is the best golf ball for a 14 handicap to play?,8
894,Which tennis player was Monica Seles' greatest rival?,8
895,Should kids play sports?,8
896,What are the pros and cons you have experienced from being a life-long athlete?,8
897,"Have you ever played organized sports, and felt discouraged because you spent most of your time sitting on the bench, sitting in the dugout, Or on the sidelines, knowing you were good enough to play?",8
898,How do you decide how much time to spend on your career vs. non-career activities?,8
899,How did you figure out what sport you are best at?,8
900,Is it easier to learn to skate on figure skates or hockey skates?,8
901,How does your mental state and confidence impact your performance in gymnastics?,8
902,"Why doesn't WWE, World Of Sports or 5 Star Wrestling want to work with Jimmy Havoc considering he is one of the UK’s biggest wrestling stars?",8
903,What are the brief basic rules for every sport?,8
904,Have you ever played field hockey? Do you think it should be more popular or not? Why?,8
905,What are some risky sports tactics that paid off?,8
906,"What, in your opinion, is the best sport and why?",8
907,"How do you stay committed to a job, hobby, sport, activity and not get bored of it?",8
908,"If a gorilla could be taught to play American football, would it be any good at it? Would its anatomy and physiology prove too much of an obstacle?",8
909,"What is the origin of the ""battle royale""?",8
910,Why does everyone seem not to like Stephen A Smith on ESPN?,8
911,I am 17 years old. Can I compete in Rio Olympic boxing in 2020?,8
912,What does the wrestling move DDT stand for?,8
913,How well does a keto diet work when doing endurance exercises (example: marathons)?,8
914,Why does Kevin Smith enjoy wearing hockey jerseys so much?,8
915,How does an athlete’s perception of time influence his sport performance?,8
916,"In most sports, if one player or team starts serving in the first set, the other one starts in the second set. Why is this different in tennis?",8
917,Would Roger Federer be as good at table tennis i.e. ping pong as tennis? Are these skills transferable?,8
918,How good does someone become after 3 years of tennis?,8
919,Is it possible to go from 16-17 seconds to 14-16 seconds for the 100m in two years? (12 years old to 14 years old),8
920,What is your fondest memory from participating in sports?,8
921,How long is a lacrosse game?,8
922,What is a golf excursion?,8
923,Why couldn't anyone beat Floyd Mayweather?,8
924,Does Tom Brady run faster than the average citizen even though he seems much slower than the rest of the league?,8
925,What kind of sports do you like to try?,8
926,"Is professional eating really a sport, even if it has its own league now - Major League Eating?",8
927,"Why do so many women professional players grunt loudly when they hit the ball? Most hard-hitting male players don’t, and I personally find it so annoying that I always mute the TV when watching them play on TV.",8
928,How long is an average hockey game?,8
929,What are the most dangerous sports?,8
930,Where is the best place to find writers that are passionate about sports and sales?,8
931,Do you think Yuzuru Hanyu could win a 3rd Olympic gold medal at the 2022 Winter Olympics?,8
932,"Do hockey players have special pads to protect them for when they hop the wall, making a player change during the game, Oor just a strong cup?",8
933,Can you win at sports betting?,8
934,What was the most epic baseball comeback you have seen?,8
935,Who are some coaches or players in the World Cup I might like? I am an American. I know nothing about football (soccer). I do not care about the team or country. Who are 'crazy'/entertaining or great people in this sport I must see?,8
936,Have you ever played field hockey? Do you think it should be more popular or not? Why?,8
937,Is 18 too late to play hockey?,8
938,How can I ace an interview for a job in sports?,8
939,What is an example of an international sports event that occurs on an annual basis in the UK?,8
940,Which sports do you like? Why?,8
941,Do you view the professional rugby competition in the US the MLR as a success?,8
