,data,flag
0,What is your favorite recipe using saffron?,0
1,How do you politely let Airbnb guests know it's disgusting and inconsiderate to stink up the house by cooking bacon?,0
2,"""The monk of 1350 enjoyed more orderly plumbing, and sweeter habits, than the Londoner of 1850"", what does that mean?",0
3,What is one food that you can’t stand?,0
4,"What is the most creative meal you've ever cooked? Was there more than one course and if so, what were they?",0
5,What is the best and tastiest homemade tomato sauce recipe? I want to cook my own pasta & my own sauce. I'm a Norwegian & I am not so good with these things.,0
6,If you are American and over 50 - do you think food (especially meat) tastes different than it did when you were a child? If so - what do you believe is creating the difference?,0
7,Why do some vegans think people want to hear about how evil it is to eat meat? Do they know that nobody takes them seriously?,0
8,"What is your favorite fast food burger ""joint"" when you're in a hurry?",0
9,"How long can an obese person go without food (or very little of it, say 200-300 calories)?",0
10,Why is baloney looked down on?,0
11,Where can I get a Trump Steak?,0
12,Have you ever eaten a breakfast burrito?,0
13,"Where is my daughter getting so much fruit from? Every day she comes home from school with an armful of various fruits; apples, pears, oranges, mangoes, tomatoes, you name it. Her allowance isn’t enough to buy all of this each day. Is she stealing?",0
14,What do you like and do not like about Mexican food?,0
15,What do you eat every day?,0
16,Is wine vegetarian?,0
17,Why should people have the legal right to eat animals?,0
18,What is the best way to boil an egg?,0
19,"What is the scientific fact behind the saying that ""eating non-veg is a sin""?",0
20,What is the most prized food of your country?,0
21,"Can someone survive eating nothing but berries and watermelons? I'm on a new fruitarian, raw food, all liquid diet and that's all I can eat now.",0
22,As a child what was on the menu at home that you could not stand to eat? Do you like it now as an adult?,0
23,What should you never say to a vegetarian?,0
24,What happens if you ordered pizza with a phone but did not actually go to the store to pick it up?,0
25,Can a food allergy cause you to not like the taste of a food?,0
26,"What are some ways to manage acute ulcerative colitis/inflammatory bowel disease besides a vegan, gluten free and dairy free diet?",0
27,"How many people that currently eat meat would continue to do so if they had to personally raise, kill, disembowel, skin, and cut up the animal every time they ate meat?",0
28,What do you do when there are worms in maize meal?,0
29,I’m thinking of starting intermittent fasting but I’m not sure I couldn’t eat breakfast because I already eat a lot for breakfast and still get hungry by dinner time?,0
30,When did humans start to eat meat?,0
31,What is the strangest thing you've eaten at a barbecue?,0
32,What is the most expensive meal you have ever eaten? Was it worth the price? Where were you?,0
33,What is your favorite restaurant if you need pizza delivered to your house?,0
34,"Is it okay to say, “they didn't choose to adopt a vegan lifestyle”?",0
35,What is your favourite malted dish to bake and taste?,0
36,How do you politely let Airbnb guests know it's disgusting and inconsiderate to stink up the house by cooking bacon?,0
37,What food have you sent back at a restaurant?,0
38,"What is your favorite fast food burger ""joint"" when you're in a hurry?",0
39,"If you could only eat a certain amount of food every day, how much food would you eat?",0
40,Would it be easier to thaw frozen food by first placing the item in the microwave on defrost and then grill it after?,0
41,What is your favorite breakfast food when you are in a hurry?,0
42,Can we be addicted to the very food we are allergic to?,0
43,Why are you boycotting Papa John’s Pizza?,0
44,Can a fast food worker run for Congress?,0
45,Has switching from a high-fruit vegan diet to a McDougall style starch-based diet helped you resolve gut issues (e.g. IBS)?,0
46,Why is there a CO2 shortage in Europe in the summer of 2018?,0
47,What was the first Michelin rated restaurant you dined at and would you say that price tag of the meal provided a comparable value? In what ways did the experience exceed or not meet your expectations?,0
48,What are the least popular flavors of La Croix?,0
49,"Why does eating beans cause me to fart so much and also upsets my stomach every single time, despite the fact that it's my favorite food? What can I do to stop the reactions because I would really love to continue eating them?",0
50,What is the healthiest food you can find in a typical convenience store?,0
51,How did people obtain food in the older days?,0
52,What is your favorite flavor of soda?,0
53,Have you ever eaten a Cuban sandwich?,0
54,Would you feel bad for the owner by ordering a lot of expensive food at a buffet restaurant?,0
55,What is your best homemade doggie treat recipe?,0
56,"If you had to eat fast food for every meal for a whole week, you may ignore health concerns, what would you pick?",0
57,What are the best tips to create a proper American BBQ? I am an Englishman.,0
58,"If I were to lace the food that I sell with heroine or cocaine, will the customers get addicted to my food and buy it more often?",0
59,What food have you sent back at a restaurant?,0
60,Has switching from a high-fruit vegan diet to a McDougall style starch-based diet helped you resolve gut issues (e.g. IBS)?,0
61,"Which is more popular in the US, burgers or hot dogs?",0
62,Do you know any good vegetable salad recipes with no meat (pictures would be helpful)?,0
63,What’s your favorite type of fish to eat?,0
64,Why do some people hate onions so much?,0
65,What food should be given to dogs when they are in heat?,0
66,Does anyone know how to eliminate gamey taste of sika deer meat bought in amazon site.,0
67,What is the unhealthiest meal you were served on a regular basis as a kid? Do you still eat this?,0
68,If you are American and over 50 - do you think food (especially meat) tastes different than it did when you were a child? If so - what do you believe is creating the difference?,0
69,Where can I get a Trump Steak?,0
70,Do you struggle to be vegetarian?,0
71,Why do Mongols prefer to boil lamb rather than barbecue lamb? Roasted meat always tastes and smells much better.,0
72,"What is your favorite fast food burger ""joint"" when you're in a hurry?",0
73,What is the most unusual type of meat or seafood you ever tried?,0
74,What is your favorite kind of meat to eat?,0
75,What is the cheapest but most delicious meal you've ever had?,0
76,How do you handle a vegan?,0
77,What sole food would you force your enemy to eat for the rest of their life?,0
78,"When cereal is put in milk, does the milk cease to be a beverage, and become something else (i.e. a sauce, a broth, condiment)?",0
79,Is it necessary to cover yogurt in the fridge?,0
80,"What is your favorite fast food burger ""joint"" when you're in a hurry?",0
81,If there was a living cow in front of your favorite steakhouse would you still order a steak or go with the chicken or fish?,0
82,What is the strangest conversation you've had with someone at the grocery store?,0
83,Are military rations different from other types of food?,0
84,How do I prevent my food from getting cleared from the table whenever I go to the bathroom at a fast food restaurant when I didn't bring anything with me?,0
85,What’s the most depressing meal you’ve eaten?,0
86,What is your favorite breakfast food when you are in a hurry?,0
87,How do you politely let Airbnb guests know it's disgusting and inconsiderate to stink up the house by cooking bacon?,0
88,Is corn syrup healthy?,0
89,Do you ever see how much you can hold at the grocery store without a basket or cart?,0
90,"How can non-vegetarians distinguish and behave differently towards their food and pets? What stops them from hurting, killing, and eating those animals?",0
91,What good food is needed if you are a vegetarian but cannot eat onions or garlics and still get healthy?,0
92,Have you ever tried stinky tofu? What does it taste like?,0
93,Why do people cook at home?,0
94,"Why haven't scientists tried to genetically engineer potatoes so that they can be more nutritious (e.g., contain more vitamins and minerals)?",0
95,"Why do most people eat certain animals and not certain others? Has it historically been a matter of taste and convenience, or something more?",0
96,Why do some vegans think people want to hear about how evil it is to eat meat? Do they know that nobody takes them seriously?,0
97,What is the best night market in Taiwan?,0
98,"Why do people move/hide food in the supermarket? Every day, I find refrigerated food like milk, cream, meat, yogurt, etc. left on some random shelf. These are just randomly dropped off or hidden on a shelf.",0
99,What’s the most overrated restaurant you’ve eaten at?,0
100,What should I do when a person feeds my aunt’s dog biscuits and other sweet human food?,0
101,Why are you boycotting Papa John’s Pizza?,0
102,How come when you eat a pound of food you don’t gain a pound in weight?,0
103,Which country has the worst cuisine?,0
104,Can I eat sour salt during my menstrual flow?,0
105,Why do people eat non-veg when they can survive by having veg?,0
106,What is the unhealthiest meal you were served on a regular basis as a kid? Do you still eat this?,0
107,What are some instant red flags on resumés?,1
108,Why should anyone believe Chinese culture is really old when all of the ancient buildings are newer than most of Disneyland?,1
109,Why does Warsaw feel so much whiter than Berlin racially speaking when they are both European capitals with a similar history?,1
110,What is the difference between real and ideal culture?,1
111,Western legal systems have a tradition of prioritizing respect over freedom of speech (you can't write your opinion on a grave). Is it possible to define laws that forbid hurting beliefs (cartoons of the balls of Muhammad) but allow criticism?,1
112,What's it like to work for a competent manager who's extremely judgmental?,1
113,What is wrong with our society today?,1
114,What is Brazil's biggest cultural export?,1
115,Are there any moral traits shared by all cultures that we know of through the entirety of world history?,1
116,Why do humans react to racism with using racist methods?,1
117,Who would you least prefer to work with - someone whose politics are the direct opposite of your own or someone who is apolitical?,1
118,"Regarding cultural appropriation, how can you get permission from the whole culture?",1
119,"Do you know any Europeans who look like East Asian or slightly East Asian, but who are not? If so, what are your thoughts?",1
120,How long until Islam and immigration changes Europe’s culture?,1
121,What food from your culture is typically ruined when it is commercialized?,1
122,Is diversity more important than competence?,1
123,What is it like to be in an interracial relationship?,1
124,Which ethnicity are you?,1
125,How is the persuit of happiness viewed across different cultures?,1
126,Why do I feel as if a sense of inauthenticity permeates throughout my culture and most cultures on earth?,1
127,Why does Warsaw feel so much whiter than Berlin racially speaking when they are both European capitals with a similar history?,1
128,"Is Nepal a multilingual, multi-ethic, multi-religious, and multicultural country?",1
129,What is wrong with our society today?,1
130,Which ethnicity are you?,1
131,"What's totally normal in your country, but completely unthinkable in another?",1
132,What is wrong with our society today?,1
133,What is the relationship between philosophy and cultural anthropology? How are they similar/different?,1
134,"What is ""racism""? If the ethnic minorities in one nation are oppressed by the majority and are angry at the dominant ethnicity, would this be called racism?",1
135,Is Korea culturally and linguistically closer to China or Japan?,1
136,"While conversing with a Dutch couple, I said I had a firearm on my person, support arming teachers, and would never live in a country without a death penalty. They immediately got up and left. Are all Europeans this narrow-minded (and rude)?",1
137,What's it like to be mistaken for being a different ethnicity than you actually are?,1
138,What are some little-known ways companies secretly monitor their employees?,1
139,What is wrong with our society today?,1
140,"Do you believe cultural appropriation exists and, if you do, how far back with lineage should we go and how lenient should we be with it?",1
141,"At work, what euphemisms do your colleagues use to describe people or ideas they don't like or respect?",1
142,What are some ways that supervisors can improve low morale amongst their employees?,1
143,What do Americans think of Iraq war?,1
144,What is wrong with our society today?,1
145,What are the benefits of globalization?,1
146,What do uncovered Western women think of when they see us Muslim women who wear a niqab and are covered from head to toe?,1
147,Have you or someone you know seen a coworker get arrested at work?,1
148,What are some unique customs in your country?,1
149,"Whom would you fire: the least popular or the worst performing employee, if you had to fire someone in your company?",1
150,"While conversing with a Dutch couple, I said I had a firearm on my person, support arming teachers, and would never live in a country without a death penalty. They immediately got up and left. Are all Europeans this narrow-minded (and rude)?",1
151,"How do you integrate two different cultures, if their respective customs cannot be shared and embraced without upsetting those very people who claim to support and promote cultural integration?",1
152,Western legal systems have a tradition of prioritizing respect over freedom of speech (you can't write your opinion on a grave). Is it possible to define laws that forbid hurting beliefs (cartoons of the balls of Muhammad) but allow criticism?,1
153,Is Islamophobia a type of racism?,1
154,Is it racist/culturally appropriate to wear a dashiki if I am not an African?,1
155,"How did the mangonel and onager become the popular image for catapults when they were not the most widely used. I understand that they are the most commonly featured in pop culture, what I want to know is how that started.",1
156,What's it like to be mistaken for being a different ethnicity than you actually are?,1
157,"In my country, I see that this generation of young college students have developed a very Americanized culture with English speakers being common. Do you see this in your country too?",1
158,"Is it more fair to look at ""superiority"" in terms of differences in culture, rather than race?",1
159,What are three noteworthy oddities of the Swedish culture?,1
160,What is the cultural or social context of contemporary dance?,1
161,Is Semite a race or ethnicity?,1
162,What is wrong with our society today?,1
163,Why does Warsaw feel so much whiter than Berlin racially speaking when they are both European capitals with a similar history?,1
164,"What is meant by the ""social construction of ethnicity"" and what are some examples?",1
165,How can some people care more about animals than they do about a person of another race or ethnic background?,1
166,What is wrong with our society today?,1
167,What aspects of office culture are important to employees?,1
168,"If your employer suddenly decided to change their policies and the way they do things, besides pay, what's the most realistic thing they could change, eliminate, or start implementing that would be the ""Deal Breaker,"" forcing you to quit?",1
169,Should people only strive to emulate the culture that they were raised within to reduce cultural appropriation? How would this limit or assist culture?,1
170,Why do some people think that their cultures and values are primary? They don't seem to interest me.,1
171,What does the Turkish and Korean culture have in common?,1
172,How has Western culture influenced the modern world?,1
173,"How do you integrate two different cultures, if their respective customs cannot be shared and embraced without upsetting those very people who claim to support and promote cultural integration?",1
174,How would you describe the world scenario where marijuana would become the global symbol for humanity?,1
175,"What kind of culture surprise, culture stress, culture shock or reentry culture shock (when you come back to your home country) did you have after visiting Japan?",1
176,Do the Japanese and Chinese hate each other?,1
177,Why are some people offended by cultural appropriation?,1
178,How bad is racism in Malaysia?,1
179,"Would improving the American educational system be a valid method of reducing Christianity’s influence in society, politics, and culture?",1
180,Why is the concept of ‘losing face’ so strong in Chinese culture?,1
181,Can you address stigma about shy people in the Western culture nowadays?,1
182,What is wrong with our society today?,1
183,What are the best names in history?,1
184,How did human and cultural evolution take place?,1
185,"What should I do, continue to hire the new staff when I know she will marry in her first month in the office and probably will soon get pregnant, while I think I need someone who could work totally or find another one?",1
186,"What do you mean when you say ""Western Culture"" or ""Western Civilization""? Where exactly is the West? What is the West?",1
187,"Do you think that we can ever overcome racism? If so, how?",1
188,What is wrong with our society today?,1
189,What do you like and dislike about your culture?,1
190,How did human and cultural evolution take place?,1
191,"What advice would Tolkien and Lewis give someone regarding writing to honor their heritage, say, their English heritage? What would they suggest the person do in their story to show their love for their ancestors and cultural heritage?",1
192,What’s the worst quality a boss could have?,1
193,What is wrong with our society today?,1
194,Why do we focus so much on white racism? There is racism in every culture and at every social level.,1
195,What is a foreign custom that you wish was commonly observed in your country?,1
196,"To what extent are hydrogen and hydroxide ions responsible for lightning? If clouds were to somehow be composed of pure, stable water molecules would lightning still occur?",2
197,Why is weather pattern not the same over the years even though the location of the Earth from the sun remains the same (January 1st weather is not the same over the years)?,2
198,What is the best temperature for our central A/C during a heat wave?,2
199,How would you make a wind powered LED light that has no battery and provides light whenever there is wind?,2
200,Which winds bring rainfall to the Mediterranean regions of South Africa during the winter?,2
201,Why do airplanes have pressurized cabins for passengers’ safety while flying in the atmosphere?,2
202,Are there any real chances of global climate getting cooler in summers and even more colder in winters?,2
203,How is there oxygen in the ozone layer since oxygen is such a heavy element?,2
204,Could wind turbines withstand Category 5 hurricanes?,2
205,How do you define system equations in model-based design if you don't know how the system works?,2
206,What is the importance of atmospheric pressure?,2
207,What are the reasons for deviation of gases from ideal behavior?,2
208,Why are there so many clouds in the sky every day?,2
209,Why do people get a cold?,2
210,What would happen if there was no atmosphere on Earth?,2
211,"What is the relationship between the greenhouse effect, ozone layer depletion, and climate change?",2
212,Why is it easy to find pictures of things in fluffy clouds in the sky?,2
213,What makes aurora borealis blue or green or yellow - etc?,2
214,Why does it snow in Michigan?,2
215,Does thunder form on the upper side of the clouds?,2
216,Is weather associated with the inclination of Earth orbiting the sun or an Islamic hadith that explains weather resulting from a hot and cold hell?,2
217,How do meteorologists be wrong half the time and still get to keep their jobs?,2
218,Which device masures the velocity of wind?,2
219,How did people in the north deal with cold weather in ancient times?,2
220,"Why wasn't ""Lightning Strikes""by Aerosmith better appreciated? I almost never hear it played on classic rock stations.",2
221,Why is Australia hot when it’s near Antarctica?,2
222,"Is the quote ""An airplane always takes off into the wind, and not with the wind"" always true? Aren’t there cases where an airplane takes off in the same direction the wind is blowing, or would they use a different runway to take off into the wind?",2
223,"Is it possible to have 100% atmospheric humidity? If so, is it called rain?",2
224,Does the morning sky appear aesthetically different in different climate zones?,2
225,How do clouds attract the other clouds towards them?,2
226,What do aircraft carriers do in a storm?,2
227,How do you simulate air pressure?,2
228,"Which is right, ""I struck him on the leg"" or "" I struck him in the leg""?",2
229,What are some examples of seeds dispersed by wind?,2
230,What is the cause of wind in our environment?,2
231,"Why have we not devised a way to harness the electricity from lightning strikes? And furthermore, why have we not put tremendous resources and effort into developing a method to do this?",2
232,"Why do people think Australia is always hot? I live in Australia, and it reaches -10 degrees overnight in winter.",2
233,Why is it colder at the North Pole than the South Pole?,2
234,What are some examples of seeds dispersed by wind?,2
235,Why are you proposing that there was something in the universe when almost all Atheists believe that there was creation from nothing and truly nothing?,2
236,What are the features and disadvantages of the self wind mechanical watch and hand _wound one?,2
237,What factors affect the climate of a place?,2
238,What would happen if there was no wind on the Earth for a month?,2
239,What is going on with the heat wave hitting New York this summer?,2
240,"How, in the early days of the space race, did they know space had no oxygen, and there was a need for a space suit, etc.?",2
241,What is the minimum temperature to get a tan?,2
242,Which state in the USA has the same climate as the climate in the Netherlands?,2
243,Why does the space shuttle or a space capsule face immense resistance from Earth's atmosphere while returning to Earth and why not while taking off?,2
244,"During hurricanes, do roofs usually come off because the internal pressure is higher than the external pressure or because of the force of the wind on the house?",2
245,"Can a hurricane hit Denver, Colorado?",2
246,What the diference between lightning and surger arresters?,2
247,What is the best solution for a highway-based wind turbine to have constant AC irrespective of fluctuating wind speed?,2
248,What is the approximate wind speed in this video I recorded? Would this be considered gale-force?,2
249,What percentage of climate change is human caused?,2
250,What is it like to stand under a giant Supercell storm’s cloud wall that’s almost touches the ground?,2
251,Why can't we harness the power of the air like clouds do when they generate lightning?,2
252,What human activity has damaged the atmosphere?,2
253,"If an electric guitar were strummed in a vacuum of space, how would the sound differ from atmospheric pressure?",2
254,Why is so dangerous for ground personnel if pilots turn on the Airbone Weather Radar while on ground?,2
255,What are the influence of a high barometric pressure on the oxygen levels in water?,2
256,Why does cold hurt?,2
257,What increases the relative humidity of a room? Does humidity depend on the temperature or the partial pressure of the water(g)?,2
258,Has it ever snowed in Honolulu?,2
259,Why does it always rain in Indonesia even though it's summer already?,2
260,How do Arabs and other nationalities keep cool during hot weather?,2
261,Why don’t places like Japan with high pollution start planting trees everywhere to help absorb the Co2 in the atmosphere?,2
262,What is your favorite food in really hot weather?,2
263,"How much adverse effect can extensive cloud seeding have on climate, both local and global? Does the chaos theory have any role to play in the long term effects of cloud seeding on weather?",2
264,"Which is right, ""I struck him on the leg"" or "" I struck him in the leg""?",2
265,How is there oxygen in the ozone layer since oxygen is such a heavy element?,2
266,What is the best wind speed for windsurfing?,2
267,Does humidity increases after the rain?,2
268,How does it look and feel in Texas?,2
269,What is the weather like in Dubai in August compared to Kuwait?,2
270,How much electricity is in a lightning bolt?,2
271,"How do people in the American South deal with the heat and humidity in the summer? It’s really humid, and I am in SE Michigan.",2
272,Why is the latitude of the ITCZ so important?,2
273,"Among the 4 substystems (atmosphere, geosphere, hydrosphere, biosphere) of Earth, which plays the biggest part on sustaining life and why?",2
274,"Hypothetically, how fast would an indestructible eagle have to fly to cause hurricane force winds with its wingbeats?",2
275,What is your favorite weather?,2
276,What is an effect of the difference between the amount of light the same spot received in the winter in the summer?,2
277,Why is the weather nowadays so hot in Singapore?,2
278,How is rain water penetration prevented for buildings with a large area of perforated walls?,2
279,"If you put a superconductor in space and insulate it from sunlight, will it stay cold enough to keep zero resistance forever, or will it eventually warm up while under electrical load?",2
