,data,flag
280,Is there water produced from any chemical reaction inside the atmosphere or is the water floating in the atmosphere coming only from evaporation of oceans?,2
281,What can make a cloud suddenly dissipate and dissolve away?,2
282,What happens if CO2 increases in the atmosphere?,2
283,"What will happen to decommissioned offshore wind farms? Will they be abandoned, sunk, or recycled. Who will pay to perform the work?",2
284,Could HAARP have been part of the cause of global warming?,2
285,How closeness to the equator affects the weather?,2
286,How do musicians find places for their tours?,3
287,What type of people go on tours in London and why?,3
288,Which is the best tour and travel operator for booking Thailand Tour Packages?,3
289,"Travelers of Quora, would you pay more for a private tour OR market value for a tour that is designed for the masses?",3
290,What do you do as a tour guide if a person in your group gets lost?,3
291,Where can I find the perfect private tour guide?,3
292,"Travelers of Quora, would you pay more for a private tour OR market value for a tour that is designed for the masses?",3
293,What will be the total cost for Europe tour?,3
294,What type of people go on tours in London and why?,3
295,"How do I answer why my mother, who is on pension, is sponsoring me for my London visiting tour?",3
296,What are the 5 things you need to get from the tour guide when you are in a tour?,3
297,"Should I ask multiple members of Congress (my Congressperson (member of the House) plus my two Senators) in Congress for a tour of the White House and the Capitol, or just one?",3
298,What are the best train tours in America?,3
299,Which tour operator in South Africa offers a wide range of tours for the Pilanesberg National Park?,3
300,How do tour operators find their clients?,3
301,What is better for you to go alone or go on tour?,3
302,"Is there a word for a tourist who isn't a ""backpacker"" or ""luxury tourist,"" who has sufficient income to do a luxury tour but prefers adventure?",3
303,What company provides the best tours in Dubai?,3
304,Which is the best time for Egypt Tours?,3
305,Would you recommend an escorted tour or an independent tour of Japan?,3
306,How much will it cost to tour Paris?,3
307,How can I market a travel and tours agency?,3
308,What are the top-rated tours in Iceland?,3
309,"Is there a word for a tourist who isn't a ""backpacker"" or ""luxury tourist,"" who has sufficient income to do a luxury tour but prefers adventure?",3
310,How can I market a travel and tours agency?,3
311,What is the best tour guide for Europe?,3
312,"Is there a word for a tourist who isn't a ""backpacker"" or ""luxury tourist,"" who has sufficient income to do a luxury tour but prefers adventure?",3
313,Should I go to Japan by myself or with a tour group?,3
314,Would you recommend an escorted tour or an independent tour of Japan?,3
315,"Did you ever take a food-tour? If so, would you recommend it?",3
316,What is better for you to go alone or go on tour?,3
317,What is an escorted tour in New Zealand?,3
318,Which is the best tour and travel operator for booking Thailand Tour Packages?,3
319,Can I do a tour around the world by bike?,3
320,How do tour guides avoid losing interest while doing the same tour over and over?,3
321,Should I take a Segway tour in Warsaw or Vienna? (I can only choose one).,3
322,Which tour company do you recommend for multi-country Europe trips?,3
323,What is the difference between a tour guide and a tourist guide?,3
324,What is your travel company?,3
325,How much will it cost to tour Paris?,3
326,"What is the best bus tour in Paris? Also, has anyone gone on a walking tour in Paris?",3
327,How do I do a world tour on motorbikes?,3
328,Would you recommend an escorted tour or an independent tour of Japan?,3
329,How can I market a travel and tours agency?,3
330,What is better for you to go alone or go on tour?,3
331,Have you ever went for a dental tour? How did you select it?,3
332,"Which option is preferable for a trip to Malaysia & Singapore with parents, individual booking or a package tour?",3
333,"What are the best ways for travelers to book travel activity, such as tours? Why?",3
334,What is better for you to go alone or go on tour?,3
335,What company provides the best tours in Dubai?,3
336,What is it like to go on a tour of the White House?,3
337,Which travel company offers the best tour of Jerusalem?,3
338,How much time does it take to prepare for a Showaround tour?,3
339,What are some affordable escorted caravan tours in Europe?,3
340,"Travelling in a new country, would you be willing to have a local unofficial tour guide, rather than a fully fledged tour company show you around?",3
341,Where can I find tour and travel services?,3
342,"Is there a word for a tourist who isn't a ""backpacker"" or ""luxury tourist,"" who has sufficient income to do a luxury tour but prefers adventure?",3
343,How much does it cost (on average) to travel around the world for a year?,3
344,What should I see in Ukraine? Is Chernobyl safe for visiting?,3
345,Which is the best website for international tour packages?,3
346,What is better for you to go alone or go on tour?,3
347,What is it like to take a Globus tour?,3
348,Which tour company do you recommend for multi-country Europe trips?,3
349,How can I market a travel and tours agency?,3
350,How much will it cost to tour Paris?,3
351,Which tour company do you recommend for multi-country Europe trips?,3
352,How much time does it take to prepare for a Showaround tour?,3
353,What are the things to keep in mind while travelling to Italy in November?,3
354,Which is the best tour and travel operator for booking Thailand Tour Packages?,3
355,How do I choose the best Malaysia tour packages?,3
356,Would you recommend an escorted tour or an independent tour of Japan?,3
357,Can I do a tour around the world by bike?,3
358,How do musicians find places for their tours?,3
359,What's the best trade you've had at a festival or on tour?,3
360,"If you were planning a holiday trip in Kenya, which tour company would you use?",3
361,Are there new audio / tour guide apps like HearPlanet?,3
362,"Travelers of Quora, would you pay more for a private tour OR market value for a tour that is designed for the masses?",3
363,"In building a tour firm or company in developing countries, does one need to have links with supporting businesses in the industry like hotels and airlines? How does one negotiate B2B terms to get the best contract rates locally and internationally?",3
364,"Should I ask multiple members of Congress (my Congressperson (member of the House) plus my two Senators) in Congress for a tour of the White House and the Capitol, or just one?",3
365,What are some island tours that I can take from Phuket?,3
366,Where can I find tour and travel services?,3
367,Where can I find the perfect private tour guide?,3
368,What is your travel company?,3
369,I want to start a tour guide cum transport service for disabled tourists in Europe. Is there a big enough market for this?,3
370,"Should I ask multiple members of Congress (my Congressperson (member of the House) plus my two Senators) in Congress for a tour of the White House and the Capitol, or just one?",3
371,How can I become a tour guide?,3
372,What is the best company to take guided bike tours with in Bangkok?,3
373,Which would you choose? For the same price you can take a private/small-group tour or a big tour bus full of people to go to the same tourist spot.,3
374,How do musicians find places for their tours?,3
375,What's your favorite travel web/mobile app? Why?,3
376,What is one reason you gave up on something you cared about?,4
377,Does the World's Greatest Dad get upset when he sees everybody wearing his T-shirt?,4
378,How are humans able to dominate nature?,4
379,"Do liberals want people to ""feel"" instead of think?",4
380,Why does it seem like atheists are particularly irritated when asked why they don't believe in God?,4
381,What is wrong with our society today?,4
382,How lonely are you?,4
383,How do narcissists suck you into their reality? And why do they torture your pets after you leave?,4
384,How do you get your focus back into your life in spite of seeing the person who wrecked your life mentally and emotionally on a daily basis?,4
385,Should we feel sympathy for the homeless?,4
386,Why is practicing abstinence frowned upon? It sounds like the most effective birth control.,4
387,What's the rudest thing a customer did at your work?,4
388,Do you lie about getting into physical fights to intimidate others so they don't mess with you?,4
389,"As a member of the LGBT+ community, I am curious: Why do some lesbians tell straight women that men are bad partners, and women are good partners?",4
390,Do you like having people over at your house?,4
391,What can you say or show me to make me feel nostalgic about the 80's?,4
392,"What is a common, incorrect judgment people make about you?",4
393,I'm going to be an adult soon which makes me realize even more how much I don't want to be alive. I feel very lost and don't know what to do?,4
394,What is a thing that you don’t like to do but everyone else does?,4
395,Is it just me or do people seem remarkably more angry today?,4
396,Will you apologise to a girl for not replying to her texts after a few hours?,4
397,Do you find yourself doing things for others because it's expected of you?,4
398,Why do you hate a person?,4
399,What are some things you realized when you got mature?,4
400,Do some people get grotesquely overweight for the same reason some people get acne vulgaris and others don't?,4
401,Why does it seem like atheists are particularly irritated when asked why they don't believe in God?,4
402,Why do people make fun of Rahul Gandhi?,4
403,"What are your thoughts on people who are so committed to pacifism, they will choose not to commit violence even to defend their own lives?",4
404,"I broke up with my emotionally unstable boyfriend, how do I move on?",4
405,Have you noticed that some people are always reading between the lines of the questions asked? Sometimes they make elaborate assumptions. Why do people do this?,4
406,Are people today more empathetic and sensitive to the pains of others than previous generations?,4
407,Why does it seem like atheists are particularly irritated when asked why they don't believe in God?,4
408,"I’m trying to get over a guy, but it’s hard because I feel empty now and I feel there’s nothing to look forward to. Why is this, and what could I do to change it?",4
409,Are there too many people in the world?,4
410,Why do people change their personality?,4
411,"I feel an urge for a change of environment but I've never left home, where would be a safe and nice place to temporarily emigrate?",4
412,What would happen to a 15-year-old if he kept watching violent videos?,4
413,What person has tried your patience the most in your life?,4
414,What was the last thing that made you feel uncool?,4
415,Why are Northerners so rude compared to Southerners?,4
416,Why do I feel the need to justify myself when I don’t want to hang out with someone?,4
417,What is the worst feeling in your life?,4
418,"What is ""common knowledge"" about being a white person in the USA that's false?",4
419,Why do people stare at you?,4
420,What is the worst feeling in your life?,4
421,How do I not get affected by the success of a person who did wrong to me and had hurt me the most?,4
422,Do you hate it when someone criticizes you when other people are around and they can all hear?,4
423,"How do we console a person who stole precious things, but returned back fearing servants would be blamed? They were rewarded, but he is upset by such an act which was done out of anger.",4
424,Why do strangers make fun of me?,4
425,Can we do or say anything that can hurt or embarrass a narcissist?,4
426,How vengeful are you?,4
427,What is the incentive of being nice if you are an atheist? Why won't you steal things if you have no chance of being caught doing that as an example?,4
428,What is race?,4
429,Why do politicians claim to represent the American people but yet don’t take the voices of the people into consideration and lie to us as they do?,4
430,"Why do conservatives claim to be for small government, yet want to control people's private lives?",4
431,Why is practicing abstinence frowned upon? It sounds like the most effective birth control.,4
432,Is it possible to change how you feel about a person?,4
433,Why are there so many people interested in politics nowadays?,4
434,"Do you agree that people judge others more based on their odor than looks? Have you done this, or had it been done to you? What was it like?",4
435,What is wrong with our society today?,4
436,What makes people back in the ancient ages believe deities? Did they come in dreams of some humans or give hallucination to certain people?,4
437,What is the manliest thing you've ever witnessed?,4
438,Why do people want to be vegan?,4
439,"Are there people who just don't like to communicate via a mobile device, i.e. WhatsApp, text, chats etc.?",4
440,"After noticing my brother had a gradual shift in attitude from being kind and thoughtful to conceited and narcissistic, what can I say that would help him see that?",4
441,How do I know if someone is lying online?,4
442,How do you stop boys from grooping you?,4
443,When was a time that making an assumption about someone or something got you in trouble?,4
444,I'm 25 and have to be extremely self-sufficient as my family are all extremely selfish and uncaring. The pressure of doing this makes me struggle. How can I not struggle and be in control of my own life?,4
445,"Can a narcissist change? We have been together on and off for 3 years. After the last breakup, he came back and had put himself in therapy and started to admit the things he did wrong.",4
446,Why is Indonesia known as a rude country when it is very nice?,4
447,Why do you feel the need you feel like you constantly need to tell people what to do?,4
448,What do psychopaths think about the Somatic Marker Theory and how does your tuned-down emotional range affect your decision-making?,4
449,Do you ever worry that in the future non-monogamous relationships will become the social norm?,4
450,How can you promote the idea that kindness is dignified and hatred is disgusting?,4
451,How bad were you when you were little?,4
452,"Why can't I end things with my fwb? I broke it off with him and cried like a baby, and called him two days later. Now I want to break it off again? It feels like a real breakup. Am I falling for him?",4
453,"If you had a chance to shift the position of your country on the map, where would it be?",4
454,What kind of people will not succeed in life?,4
455,Why are people so cruel to narcissists if they have a mental illness?,4
456,"Recently I confessed my feelings to my bisexual friend. I wanted an answer, but she told me not to force an answer out of her. Last night at work, she flirted outrageously with me. I'm left feeling very confused and hurt. What should I do now?",4
457,What is the ugliest truth about getting old that most try to willfully ignore?,4
458,What is the incentive of being nice if you are an atheist? Why won't you steal things if you have no chance of being caught doing that as an example?,4
459,Have you noticed that some people are always reading between the lines of the questions asked? Sometimes they make elaborate assumptions. Why do people do this?,4
460,What is something you wish was more socially acceptable?,4
461,What is the worst feeling in your life?,4
462,What was the last thing that made you feel uncool?,4
463,Why do people stare at you?,4
464,Why is practicing abstinence frowned upon? It sounds like the most effective birth control.,4
465,"Do narcissists in friendships (as opposed to romantic relationships) behave the same way/show the same patterns, or does it play out differently? Is it harder to spot a narcissist friend than a narcissist boyfriend/girlfriend?",4
466,Is it wrong of me to feel contempt for willfully ignorant people?,4
467,I never validate the narcissistic person I have in my life so he influences how people see me to take revenge. What should I do?,4
468,What feelings did you get when at some point you realized you are not safe?,4
469,Why is practicing abstinence frowned upon? It sounds like the most effective birth control.,4
470,"How does one acquire an opinion, how do we gauge the opinions of others and is there certain requirements to ones opinion that should be met before said opinion being voiced? (a few bonus questions)",4
471,How lonely are you?,4
472,I asked my girlfriend to stop being passive aggressive and she called me a narcissist that is trying to control her emotions. Is she right?,4
473,What are some habits that are good to get into?,4
474,Who can honestly say that they can never quit on themself?,4
475,"As a plumber, what is the most common thing you see people doing wrong?",4
476,Why do I seem to attract toxic people that drain the life out of me?,4
477,"As a parent, what are the most touching things your children have done for you?",4
478,How can I stop offending people with comments or jokes? What general rules can be applied to whether or not something will offend someone?,4
479,How did you get over the guilt of breaking someone's heart?,4
480,A friend of mine often asks for my advice on her struggles but never takes it. Why would a person do this kind of thing? We aren't like teenager or anything. We are in college age.,4
481,Why do people act strangely when you’re a stranger?,4
482,Why am I always left out?,4
483,What is an unpopular opinion you have about society?,5
484,How can I deal with my family (especially my father) if they continuously reject me for not sharing all of their religious views? I love them so much.,5
485,What is the single biggest change in society that has shocked you the most and why?,5
486,What is wrong with our society today?,5
487,What career will allow me to break many societal rules?,5
488,"If happiness can be found only between ourselves, what's the point of society? Something is in my life only because I consider it valuable and beneficial.",5
489,What is the strangest conversation you've had with someone at the grocery store?,5
490,What is the cost of equality to society?,5
491,Why does society believe that we wont be happy unless we are pursuing a dream?,5
492,What is wrong with our society today?,5
493,"Should an up and coming Hollywood star use their platform for social issues or wait until they ""have fully arrived""?",5
494,What are some basic everyday things humans do that are flawed?,5
495,Why does it feel like everyone has depression? What is REALLY happening to our society?,5
496,Where does superficiality in our society mainly stem from?,5
497,What everyday practices have somehow gone unnoticed by today's highly germ-conscious society?,5
498,Why are introverts often viewed negatively by society?,5
499,What does justice mean to you?,5
500,Are the movements for the rights of women imparting a negative impact on society?,5
501,What is right with Chinese society today?,5
502,"If you were granted a license to do whatever you wanted, what would you do every day that others cannot without recompense?",5
503,How should we go about solving the issue of the uninformed voter?,5
504,"How will Britain solve its major problems like aging population, crumbling NHS, lack of social care, housing crisis, rising crimes, poverty etc.?",5
505,Have you ever felt completely comfortable with not “belonging” to any particular group or country?,5
506,What is your favorite flavor of soda?,5
507,What is an unpopular opinion you have about society?,5
508,"Are we pushing the responsibility for our existence on to society, instead of facing the questions of who we are?",5
509,What is wrong with our society today?,5
510,Should scientific societies take policy positions?,5
511,What is the basic to write a novel connected to social issues?,5
512,What is one social norm in your country?,5
513,"If all ladies are someone’s daughter, sister, or mother, and no sane person would mistreat those individuals related to them, then why do people end up behaving poorly around other people’s daughter, sister, or mother?",5
514,Does the term atheism imply that theism is the norm; would a more neutral term make theists less likely to see atheists as aberrant?,5
515,What are the positive benefits of being well dressed?,5
516,What is the effect of legend in our society?,5
517,What is the relationship between society and culture in the light of sports?,5
518,What do secret societies do?,5
519,"After meeting someone online, have you met them face-to-face?",5
520,Why does the society blame my ambition on becoming a filmmaker?,5
521,"As people, why do we need to relate ourselves with other people, our history and culture, and our society's institution and structures?",5
522,What enemy did you have the most difficult time defeating in a computer game or video game?,5
523,How much of who you are now is a product of your society?,5
524,Why does my significant other blame me for our issues?,5
525,What makes it unacceptable to hit adults but socially acceptable to hit children (within reason)?,5
526,Is a post scarcity society actually possible?,5
527,Do you think the Bible should change with time to fit society?,5
528,Why is cursing unacceptable behavior?,5
529,"Would firearms ban in the US give any benefits to the society, or would it further amplify the existing problems?",5
530,What is right with Chinese society today?,5
531,Are we heading toward a more humanistic society or a more materialistic one?,5
532,What is the cost of equality to society?,5
533,Do you ever worry that in the future non-monogamous relationships will become the social norm?,5
534,Would culture have developed differently if humans saw things in the ultraviolet spectrum instead of the 'visible' spectrum?,5
535,What’s the most controversial thing about you?,5
536,What is an unpopular opinion you have about society?,5
537,How is human being the product of society?,5
538,What are the 2 good effects of science and technology on society?,5
539,What is wrong with our society today?,5
540,Why are falling birth rates in some countries a big problem as the world's population is still increasing and expected to go from 7 to 9 billion which is a stress on the environment? Isn't the problem more of how to redistribute people?,5
541,"If a person is named the heir and successor for their family's business, why does everyone get mad at the person for refusing the position? Why do people get mad at the person for wanting to do something else, perhaps seek a different career?",5
542,Why do people 'ghost' in relationships?,5
543,What is your favorite flavor of soda?,5
544,How can I deal with my family (especially my father) if they continuously reject me for not sharing all of their religious views? I love them so much.,5
545,What are some examples of one person making a difference in society?,5
546,Is society getting more divided?,5
547,"Is the following statement supportable: ""Laws pertain to what we do when no one is looking; norms with what we do when people are.""?",5
548,Would the society be better without the stigma associated with one who always wants to be technically correct?,5
549,What was the worst weather you've encountered while driving?,5
550,Is Thailand a split class society?,5
551,Have white European societies wiped out more civilizations than other societies?,5
552,Do you want to be in a secret society?,5
553,"Why do humans treat animals so poorly in factory farms, bullfights, etc., when we know they have feelings and personalities like us?",5
554,"Do you agree that Australia is ""the most successful multicultural society in the world""?",5
555,"Is it weird for a 22-year-old guy and a 14-year-old girl run together, if our families are close and her mother suggested it?",5
556,During what time periods have the intellectuals of society suffered the most violent persecution?,5
557,Where do you go to if you do not want anyone to have any authority over you at all?,5
558,What would the societies before us think of us?,5
559,"Are most men afraid of growing their hair long because it's not a ""manly"" thing to do and they prefer to play the role of ""true men""?",5
560,What is the strangest RPG you have played?,5
561,What career will allow me to break many societal rules?,5
562,Why does my significant other blame me for our issues?,5
563,How can a large business be ethical without exploiting anyone in the process?,5
564,Why is it socially unacceptable to stand out and be an activist for a change in the world?,5
565,What is the effect of legend in our society?,5
566,As an American or an English person was society a better/more social/less stressful one to be a part of in the 80-90's than present day?,5
567,Is Society and religion are two faces of same coin?,5
568,Do smart people tend to be rejected by society because of jealousy?,5
569,Is society becoming too sensitive and overreactive?,5
570,Do you think the Bible should change with time to fit society?,5
571,Why are people afraid of being wrong? Isn’t this a fundamental problem with today’s society?,5
572,Where do you think the largest issue lies within the justice system? How would you suggest fix that issue?,5
573,"As a nurse, is nursing what you wanted to do as a child or did you want to be a doctor? If you wanted to be a doctor what made you go into nursing instead?",6
574,Is it a safe idea to try to start a relationship with your manager? Have you? How did it go?,6
575,"Since at-home DNA genealogy kits are proving to people that racial history is quite mixed, why do EEOC rules still require job applicants to state their race when applying for jobs? Essentially, we are all multi-racial.",6
